{
  "artifact_hashes": {
    "trial-output/challenger.py": "92ff962cfad843ec5ce85911788ffe17f42707f0d269d6a8c3c8418bd6cb5af9",
    "trial-output/comparison-report.json": "889fcd805e52b60227d362a4f544266bdf8b4b0f4f1bebc624ba7dfa74e4a91f",
    "trial-output/research-result.json": "d7717cb1f0b051ac22cff350643a95f38f6d706a9915c7091e2a4ff1363238e4"
  },
  "case_id": "paper-backed-coverage-challenger",
  "diagnostics": [
    {
      "actionable": true,
      "artifact_path": null,
      "category": "protocol_violation",
      "code": "protocol.requirement_unmet",
      "missing_evidence": [
        "the exact permitted action and event order required by the trial contract",
        "a uniquely identified causal native action with sequence and hashed identity"
      ],
      "native_action": null,
      "next_step": "Repeat the relevant step in a fresh isolated workspace using the documented entry route and preserve the required native action order.",
      "observed_evidence": [
        "native subject access audit is unknown: shell inspection is outside the bounded read allowlist"
      ],
      "severity": "error",
      "summary": "native subject access audit is unknown: shell inspection is outside the bounded read allowlist"
    },
    {
      "actionable": true,
      "artifact_path": "trial-output/comparison-report.json",
      "category": "research_comparison_outcome",
      "code": "research.comparison_outcome",
      "missing_evidence": [
        "live performance and out-of-sample return-correlation evidence remain unobserved"
      ],
      "native_action": null,
      "next_step": "Retain the observed synthetic result without a superiority claim. If justified, define a new bounded development-only comparison before drawing broader conclusions; keep live and out-of-sample claims unknown.",
      "observed_evidence": [
        "Observed synthetic development comparison status: complete_equal_calls.",
        "development pair development-alpha: completed-call status=complete_equal_calls; synthetic unique-cell difference=0; synthetic quality-pass difference=1",
        "development pair development-alpha: completed-call status=complete_equal_calls; synthetic unique-cell difference=0; synthetic quality-pass difference=-1",
        "development pair development-beta: completed-call status=complete_equal_calls; synthetic unique-cell difference=1; synthetic quality-pass difference=0",
        "development pair development-beta: completed-call status=complete_equal_calls; synthetic unique-cell difference=2; synthetic quality-pass difference=-1"
      ],
      "severity": "info",
      "summary": "Observed synthetic development comparison status: complete_equal_calls."
    }
  ],
  "entry_route": {
    "content_read_observations": [
      {
        "action": {
          "completion_sequence": 4,
          "event_sequence": 3,
          "identity_kind": "native_item_id_sha256",
          "identity_sha256": "32012c4c32888ee2c4ba4331e3c77ece9acd811a4b3abb708363123591abfea2",
          "tool": "command_execution"
        },
        "kind": "shell_content_read",
        "operand_index": 0,
        "path": "README.md",
        "segment_index": 0,
        "sequence": 4,
        "start_sequence": 3
      },
      {
        "action": {
          "completion_sequence": 4,
          "event_sequence": 3,
          "identity_kind": "native_item_id_sha256",
          "identity_sha256": "32012c4c32888ee2c4ba4331e3c77ece9acd811a4b3abb708363123591abfea2",
          "tool": "command_execution"
        },
        "kind": "shell_content_read",
        "operand_index": 1,
        "path": "AGENTS.md",
        "segment_index": 0,
        "sequence": 4,
        "start_sequence": 3
      },
      {
        "action": {
          "completion_sequence": 8,
          "event_sequence": 7,
          "identity_kind": "native_item_id_sha256",
          "identity_sha256": "4a317b6972e2f1834050485420bd71fe6fc2d87cd25d572cb4b8b327b37bc030",
          "tool": "command_execution"
        },
        "kind": "shell_content_read",
        "operand_index": 0,
        "path": "examples/fresh-agent-evals/research/README.md",
        "segment_index": 0,
        "sequence": 8,
        "start_sequence": 7
      },
      {
        "action": {
          "completion_sequence": 8,
          "event_sequence": 7,
          "identity_kind": "native_item_id_sha256",
          "identity_sha256": "4a317b6972e2f1834050485420bd71fe6fc2d87cd25d572cb4b8b327b37bc030",
          "tool": "command_execution"
        },
        "kind": "shell_content_read",
        "operand_index": 1,
        "path": "examples/fresh-agent-evals/research/task.md",
        "segment_index": 0,
        "sequence": 8,
        "start_sequence": 7
      },
      {
        "action": {
          "completion_sequence": 12,
          "event_sequence": 11,
          "identity_kind": "native_item_id_sha256",
          "identity_sha256": "9462965f2002ffb6e5ebf84d633936910b584441932a9dee26f8497eb9d82c75",
          "tool": "command_execution"
        },
        "kind": "shell_content_read",
        "operand_index": 0,
        "path": "examples/fresh-agent-evals/research/source-provenance.json",
        "segment_index": 0,
        "sequence": 12,
        "start_sequence": 11
      },
      {
        "action": {
          "completion_sequence": 12,
          "event_sequence": 11,
          "identity_kind": "native_item_id_sha256",
          "identity_sha256": "9462965f2002ffb6e5ebf84d633936910b584441932a9dee26f8497eb9d82c75",
          "tool": "command_execution"
        },
        "kind": "shell_content_read",
        "operand_index": 1,
        "path": "examples/fresh-agent-evals/research/series/native-workflow-research-1.json",
        "segment_index": 0,
        "sequence": 12,
        "start_sequence": 11
      },
      {
        "action": {
          "completion_sequence": 14,
          "event_sequence": 13,
          "identity_kind": "native_item_id_sha256",
          "identity_sha256": "919299b8b8860441036a08b8ce4a6486ee1712366afaec2286c8579387359f27",
          "tool": "command_execution"
        },
        "kind": "shell_content_read",
        "operand_index": 0,
        "path": "examples/fresh-agent-evals/research/fixture.schema.json",
        "segment_index": 0,
        "sequence": 14,
        "start_sequence": 13
      },
      {
        "action": {
          "completion_sequence": 21,
          "event_sequence": 20,
          "identity_kind": "native_item_id_sha256",
          "identity_sha256": "a26c6de8780e4e792e8ad6df3fb6ac31fe229b7b2f8bc2aa29c602e8d647918c",
          "tool": "command_execution"
        },
        "kind": "shell_content_read",
        "operand_index": 0,
        "path": "trial-output/comparison-report.json",
        "segment_index": 0,
        "sequence": 21,
        "start_sequence": 20
      }
    ],
    "contract_version": "entrypoint-first-v1",
    "criteria": {
      "entry_route": [
        "scripts/start_here.py --task <task>",
        "docs/agents/start-here.md"
      ],
      "injected_prompt_alone_satisfies_no_criterion": true,
      "root_files": [
        "README.md",
        "AGENTS.md"
      ],
      "root_files_first_content_sources": true,
      "task_route_paths": [
        "examples/fresh-agent-evals/research/README.md",
        "examples/fresh-agent-evals/research/task.md"
      ]
    },
    "entry_route_observation": {
      "action": {
        "completion_sequence": 6,
        "event_sequence": 5,
        "identity_kind": "native_item_id_sha256",
        "identity_sha256": "6a9722cdf589a2a068832c955a8253b9df87983501c03dd92e95debae1f409da",
        "tool": "command_execution"
      },
      "kind": "start_here_cli_selector",
      "operand_index": null,
      "segment_index": 0,
      "sequence": 6,
      "start_sequence": 5,
      "task": "research"
    },
    "missing_evidence": [],
    "root_entry_reads": {
      "AGENTS.md": {
        "action": {
          "completion_sequence": 4,
          "event_sequence": 3,
          "identity_kind": "native_item_id_sha256",
          "identity_sha256": "32012c4c32888ee2c4ba4331e3c77ece9acd811a4b3abb708363123591abfea2",
          "tool": "command_execution"
        },
        "operand_index": 1,
        "segment_index": 0,
        "sequence": 4
      },
      "README.md": {
        "action": {
          "completion_sequence": 4,
          "event_sequence": 3,
          "identity_kind": "native_item_id_sha256",
          "identity_sha256": "32012c4c32888ee2c4ba4331e3c77ece9acd811a4b3abb708363123591abfea2",
          "tool": "command_execution"
        },
        "operand_index": 0,
        "segment_index": 0,
        "sequence": 4
      }
    },
    "status": "pass",
    "task": "research",
    "task_route_reads": {
      "examples/fresh-agent-evals/research/README.md": {
        "action": {
          "completion_sequence": 8,
          "event_sequence": 7,
          "identity_kind": "native_item_id_sha256",
          "identity_sha256": "4a317b6972e2f1834050485420bd71fe6fc2d87cd25d572cb4b8b327b37bc030",
          "tool": "command_execution"
        },
        "kind": "shell_content_read",
        "operand_index": 0,
        "path": "examples/fresh-agent-evals/research/README.md",
        "segment_index": 0,
        "sequence": 8,
        "start_sequence": 7
      },
      "examples/fresh-agent-evals/research/task.md": {
        "action": {
          "completion_sequence": 8,
          "event_sequence": 7,
          "identity_kind": "native_item_id_sha256",
          "identity_sha256": "4a317b6972e2f1834050485420bd71fe6fc2d87cd25d572cb4b8b327b37bc030",
          "tool": "command_execution"
        },
        "kind": "shell_content_read",
        "operand_index": 1,
        "path": "examples/fresh-agent-evals/research/task.md",
        "segment_index": 0,
        "sequence": 8,
        "start_sequence": 7
      }
    }
  },
  "evidence_scope": "fresh-native-trial",
  "failure_reasons": [